<?xml version="1.0" encoding="UTF-8"?>
<rua xmlns:xsi="http://www.w3.org/2001/XMLSchema-instance"
    xsi:noNamespaceSchemaLocation="file:/Users/pedro/Desktop/MRB-rua.xsd">
    <meta>
        <número>26</número>
        <nome>Rua de S.Miguel O Anjo</nome>
    </meta>
    <corpo>
        <figura id="MRB-26-norte">
            <imagem path="../imagem/MRB-26-SaoMiguelOAnjo-Norte.png"/>
            <legenda>Rua de S.Miguel O Anjo - Norte</legenda>
        </figura>
        <figura id="MRB-26-sul">
            <imagem path="../imagem/MRB-26-SaoMiguelOAnjo-Sul.png"/>
            <legenda>Rua de S.Miguel O Anjo - Sul</legenda>
        </figura>
        <para> 
            Pequena artéria extra-muros que ligava a <lugar>rua Em Frente dos Açogues</lugar>,com
            o <lugar>campo das Hortas</lugar> e a <lugar>rua de Cruz de Pedra</lugar>.          
        </para>
        <para>
            Decalcando um troço do possível traçado da muralha da cidade romana e na pendente da 
           <lugar>capela de S.Miguel o Anjo</lugar>, era já conhecida na Idade Média com o nome de 
            <lugar>rua de Maximinos</lugar>. Destruída totalmente em <data>1384</data>, por 
            <entidade tipo="pessoa">D. João de Castela</entidade>, perdem-se depois as notícias sobre 
            a sua história.
        </para>
        <para>
            Em <data>1750</data> era uma rua talvez sem comércio, com muitas casas de sobrado, algumas
            varandas, muitas janelas com gelosias e apenas 4 edifícios totalmente construídos em pedra.
            Destas, três situavam-se curiosamente em gavetos: as casas do prazo nº8 e a 9 e a que lhe 
            ficava contígua. Esta tinha ainda a característica de apresentar uma das raras pedras de 
            armas de heráldica de família, a dos <entidade tipo="pessoa">Bravos</entidade>, existente 
            então na cidade.
        </para>
        <para>
            Das 14 casas do lado Norte e 11 do Sul, era prazos do <entidade tipo="instituição">Cabido</entidade> oito e uma, respectivamente.
        </para>
        <para>
            Desde 1891 que se chama <lugar>rua Visconde Pindela</lugar>
        </para>
        <lista-casas>
            <casa>
                <número>1</número>
                <enfiteuta>Inácio Peixoto</enfiteuta>
                <foro>50 reis e 1 galinha</foro>
                <desc>
                    <para>
                        Pertenceu ao <entidade tipo="pessoa">Padre João Rodrigues</entidade>.
                        Confronta, do norte com <lugar>casa foreira à Mitra</lugar>.
                        Foi construída depois de <data>1539</data> em pertenças do nº2.
                    </para>
                </desc>
            </casa>
            <casa>
                <número>2 e 3</número>
                <enfiteuta>Padre Pedro Francisco</enfiteuta>
                <foro>100 reis e 2 galinhas</foro>
                <desc>
                    <para>
                        A casa nº2 confronta, do poente, com o <lugar>rossio</lugar> que está
                        no princípio da <lugar>Rua da Cruz da Pedra.</lugar>
                    </para>
                </desc>
            </casa>
            <casa>
                <número>4</número>
                <enfiteuta>Gregório José Braga, alfaiate</enfiteuta>
                <foro>25 reis e 1 galinha</foro>
                <desc>
                    <para>
                        Foi construída, depois de <data>1555</data>, em pertenças do número 2.
                        Confronta, do nascente, com casa foreira à <lugar>Câmara</lugar>.
                    </para>
                </desc>
            </casa>
            <casa>
                <número>5</número>
                <foro>5 reis(de censo)</foro>
                <desc>
                    <para>
                        Os livros das pensões referem que esta casa foi de <entidade tipo="pessoa">João Gomes</entidade>,
                        genro do <entidade tipo="pessoa">Mestre Gonçalo</entidade>, «e que há muitos anos se não paga 
                        este censo».
                    </para>
                </desc>
            </casa>
            <casa>
                <número>6</número>
                <foro>5 reis(de censo)</foro>
                <desc>
                    <para>
                        O censo é pago por <entidade tipo="pessoa">Mónica Veloso de Freitas</entidade>, viúva.
                    </para>
                </desc>
            </casa>
            <casa>
                <número>7</número>
                <foro>5 reis(de censo)</foro>
                <desc>
                    <para>
                        Pertenceu <entidade tipo="pessoa">Pedro Martins</entidade>.
                        O censo é pago <entidade tipo="pessoa">Gaspar de Medeiros</entidade>.
                    </para>
                </desc>
            </casa>
            <casa>
                <número>8</número>
                <desc>
                    <para>
                        Pertence ao nº1 da rua em frente do <lugar>Açogue</lugar> para onde tem 
                        frontaria e serventia principais.
                    </para>
                </desc>
            </casa>
            <casa>
                <número>9</número>
                <enfiteuta>D.António de Noronha de Mesquita Soares</enfiteuta>
                <desc>
                    <para>
                        A casa e parte do quintal são foreiras ao <entidade tipo="instituição">Hospital de S.Marcos</entidade>.
                        Pela outra parte do quintal paga-se, de foro, 451 reis ao nº1 do Campo de S.Sebastião. Encontra-se
                        subemprazada aos herdeiros do <entidade tipo="pessoa">Padre António Velho Maciel</entidade>, beneficiado.
                        
                    </para>
                </desc>
            </casa>       
        </lista-casas>
    </corpo>
</rua>